{
  "video": {
    "id": "lesa-method-explainer",
    "title": "LESA: why diffusion caching needs stage-aware predictors",
    "method": "lesa"
  },
  "audience": {
    "level": "adjacent-researcher"
  },
  "mode": "silent",
  "scenes": [
    {
      "id": "lesa_01_why_cache",
      "title": "Why cache diffusion features?",
      "purpose": "Show that DiT inference repeats expensive work, and that caching can skip it.",
      "takeaway": "Caching avoids repeated computation, so the question becomes how to skip safely.",
      "narration": [
        {
          "beat_id": "establish",
          "kind": "introduction",
          "visual_cue": "establish",
          "text": "Diffusion runs a large network at every step, so generation is slow.",
          "words": [
            "Diffusion",
            "runs",
            "a",
            "large",
            "network",
            "at",
            "every",
            "step",
            "so",
            "generation",
            "is",
            "slow."
          ],
          "word_count": 12,
          "speaking_seconds": 5.543,
          "dwell_seconds": 0.8,
          "start": 0.0,
          "end": 5.543,
          "end_with_dwell": 6.343
        },
        {
          "beat_id": "trace",
          "visual_cue": "trace",
          "text": "Neighboring steps repeat almost the same computation.",
          "words": [
            "Neighboring",
            "steps",
            "repeat",
            "almost",
            "the",
            "same",
            "computation."
          ],
          "word_count": 7,
          "speaking_seconds": 3.28,
          "dwell_seconds": 0.25,
          "start": 6.343,
          "end": 9.623,
          "end_with_dwell": 9.873
        },
        {
          "beat_id": "reuse",
          "visual_cue": "reuse",
          "text": "Caching keeps those internal features and skips recomputing them.",
          "words": [
            "Caching",
            "keeps",
            "those",
            "internal",
            "features",
            "and",
            "skips",
            "recomputing",
            "them."
          ],
          "word_count": 9,
          "speaking_seconds": 4.137,
          "dwell_seconds": 0.25,
          "start": 9.873,
          "end": 14.01,
          "end_with_dwell": 14.26
        },
        {
          "beat_id": "conclude",
          "kind": "conclusion",
          "visual_cue": "conclude",
          "text": "The question is how to skip safely.",
          "words": [
            "The",
            "question",
            "is",
            "how",
            "to",
            "skip",
            "safely."
          ],
          "word_count": 7,
          "speaking_seconds": 3.28,
          "dwell_seconds": 0.6,
          "start": 14.26,
          "end": 17.54,
          "end_with_dwell": 18.14
        }
      ],
      "start": 0.0,
      "end": 18.14,
      "duration_seconds": 18.14,
      "tail_dwell": 0.6,
      "word_count": 35
    },
    {
      "id": "lesa_02_uniform_assumption",
      "title": "The smoothness assumption breaks",
      "purpose": "Show that reuse and forecasting assume smooth, uniform change that the real trajectory violates.",
      "takeaway": "A single fixed reuse or forecast rule cannot track changing dynamics.",
      "narration": [
        {
          "beat_id": "establish",
          "kind": "introduction",
          "visual_cue": "establish",
          "text": "The obvious trick is to reuse the last feature, or extrapolate it.",
          "words": [
            "The",
            "obvious",
            "trick",
            "is",
            "to",
            "reuse",
            "the",
            "last",
            "feature",
            "or",
            "extrapolate",
            "it."
          ],
          "word_count": 12,
          "speaking_seconds": 5.543,
          "dwell_seconds": 0.8,
          "start": 18.14,
          "end": 23.683,
          "end_with_dwell": 24.483
        },
        {
          "beat_id": "forecast",
          "visual_cue": "forecast",
          "text": "Both assume it changes smoothly, so a fitted curve should continue it.",
          "words": [
            "Both",
            "assume",
            "it",
            "changes",
            "smoothly",
            "so",
            "a",
            "fitted",
            "curve",
            "should",
            "continue",
            "it."
          ],
          "word_count": 12,
          "speaking_seconds": 5.543,
          "dwell_seconds": 0.25,
          "start": 24.483,
          "end": 30.026,
          "end_with_dwell": 30.276
        },
        {
          "beat_id": "diverge",
          "visual_cue": "diverge",
          "text": "But early on it moves a lot, and the forecast drifts away.",
          "words": [
            "But",
            "early",
            "on",
            "it",
            "moves",
            "a",
            "lot",
            "and",
            "the",
            "forecast",
            "drifts",
            "away."
          ],
          "word_count": 12,
          "speaking_seconds": 5.543,
          "dwell_seconds": 0.25,
          "start": 30.276,
          "end": 35.819,
          "end_with_dwell": 36.069
        },
        {
          "beat_id": "conclude",
          "kind": "conclusion",
          "visual_cue": "conclude",
          "text": "A fixed rule guesses a shape that keeps changing.",
          "words": [
            "A",
            "fixed",
            "rule",
            "guesses",
            "a",
            "shape",
            "that",
            "keeps",
            "changing."
          ],
          "word_count": 9,
          "speaking_seconds": 4.137,
          "dwell_seconds": 0.6,
          "start": 36.069,
          "end": 40.206,
          "end_with_dwell": 40.806
        }
      ],
      "start": 18.14,
      "end": 40.806,
      "duration_seconds": 22.666,
      "tail_dwell": 0.6,
      "word_count": 45
    },
    {
      "id": "lesa_03_stage_dynamics",
      "title": "Feature dynamics are stage-dependent",
      "purpose": "The aha moment - one trajectory has three regimes with different dynamics.",
      "takeaway": "One trajectory has three stages with different dynamics, so a single fixed rule is the wrong shape of model.",
      "narration": [
        {
          "beat_id": "replay",
          "visual_cue": "replay",
          "text": "Watch the same feature over the whole process.",
          "words": [
            "Watch",
            "the",
            "same",
            "feature",
            "over",
            "the",
            "whole",
            "process."
          ],
          "word_count": 8,
          "speaking_seconds": 3.709,
          "dwell_seconds": 0.25,
          "start": 40.806,
          "end": 44.514,
          "end_with_dwell": 44.764
        },
        {
          "beat_id": "early",
          "visual_cue": "early",
          "text": "Early on, noise is high and change is fast and uneven.",
          "words": [
            "Early",
            "on",
            "noise",
            "is",
            "high",
            "and",
            "change",
            "is",
            "fast",
            "and",
            "uneven."
          ],
          "word_count": 11,
          "speaking_seconds": 5.114,
          "dwell_seconds": 0.25,
          "start": 44.764,
          "end": 49.879,
          "end_with_dwell": 50.129
        },
        {
          "beat_id": "middle",
          "visual_cue": "middle",
          "text": "In the middle, change becomes small and smooth.",
          "words": [
            "In",
            "the",
            "middle",
            "change",
            "becomes",
            "small",
            "and",
            "smooth."
          ],
          "word_count": 8,
          "speaking_seconds": 3.829,
          "dwell_seconds": 0.25,
          "start": 50.129,
          "end": 53.957,
          "end_with_dwell": 54.207
        },
        {
          "beat_id": "late",
          "visual_cue": "late",
          "text": "Near the end it barely moves: only details are refined.",
          "words": [
            "Near",
            "the",
            "end",
            "it",
            "barely",
            "moves",
            "only",
            "details",
            "are",
            "refined."
          ],
          "word_count": 10,
          "speaking_seconds": 4.846,
          "dwell_seconds": 0.25,
          "start": 54.207,
          "end": 59.053,
          "end_with_dwell": 59.303
        },
        {
          "beat_id": "split",
          "kind": "introduction",
          "visual_cue": "split",
          "text": "One trajectory, three behaviours. Call them stages.",
          "words": [
            "One",
            "trajectory",
            "three",
            "behaviours.",
            "Call",
            "them",
            "stages."
          ],
          "word_count": 7,
          "speaking_seconds": 3.68,
          "dwell_seconds": 0.8,
          "start": 59.303,
          "end": 62.983,
          "end_with_dwell": 63.783
        },
        {
          "beat_id": "ask",
          "kind": "aha",
          "visual_cue": "ask",
          "text": "Why should one predictor handle all three?",
          "words": [
            "Why",
            "should",
            "one",
            "predictor",
            "handle",
            "all",
            "three"
          ],
          "word_count": 7,
          "speaking_seconds": 3.0,
          "dwell_seconds": 1.3,
          "start": 63.783,
          "end": 66.783,
          "end_with_dwell": 68.083
        }
      ],
      "start": 40.806,
      "end": 68.083,
      "duration_seconds": 27.277,
      "tail_dwell": 1.3,
      "word_count": 51
    },
    {
      "id": "lesa_04_stage_experts",
      "title": "One predictor becomes stage-aware experts",